{
  "actions": {
    "actions/attest-build-provenance": "e8998f949152b193b063cb0ec769d69d929409be",
    "actions/checkout": "34e114876b0b11c390a56381ad16ebd13914f8d5",
    "actions/configure-pages": "983d7736d9b0ae728b81ab479565c72886d7745b",
    "actions/dependency-review-action": "2031cfc080254a8a887f58cffee85186f0e49e48",
    "actions/deploy-pages": "d6db90164ac5ed86f2b6aed7e0febac5b3c0c03e",
    "actions/download-artifact": "d3f86a106a0bac45b974a628896c90dbdf5c8093",
    "actions/setup-python": "a26af69be951a213d495a4c3e4e4022e16d87065",
    "actions/upload-artifact": "ea165f8d65b6e75b540449e92b4886f43607fa02",
    "actions/upload-pages-artifact": "56afc609e74202658d3ffba0e8f6dda462b719fa",
    "leanprover/lean-action": "38fbc41a8c28c4cbaec22d7f7de508ec2e7c0dd9"
  },
  "labels": {
    "actions/attest-build-provenance": "v2",
    "actions/checkout": "v4",
    "actions/configure-pages": "v5",
    "actions/dependency-review-action": "v4",
    "actions/deploy-pages": "v4",
    "actions/download-artifact": "v4",
    "actions/setup-python": "v5",
    "actions/upload-artifact": "v4",
    "actions/upload-pages-artifact": "v3",
    "leanprover/lean-action": "v1"
  },
  "notes": [
    "Every external GitHub Action is pinned to a full immutable commit SHA.",
    "The labels map records the audited major tag from which each SHA was resolved.",
    "Dependabot may propose SHA updates; every update must change the manifest and workflow files together."
  ],
  "policy": "immutable-commit-shas",
  "resolved_at": "2026-06-23",
  "schema_version": 2
}
